{
  "schema_version": "nightwatch.state.v2",
  "server_now": "2026-09-10T13:42:05Z",
  "run": {
    "id": "run-example",
    "started_at": "2026-09-10T13:40:00Z",
    "baseline": { "status": "collecting", "collected_secs": 45, "required_secs": 120 }
  },
  "readiness": {
    "ready": false,
    "checks": [
      { "id": "baseline", "status": "waiting", "detail_zh": "正在收集基線" }
    ],
    "next_step_zh": "請等待基線完成"
  },
  "model": { "available": false, "model": "", "effort": "high" },
  "graph_now": {
    "schema_version": "nightwatch.snapshot.v2",
    "seq": 1832,
    "at": "2026-09-10T13:42:05Z",
    "nodes": [
      {
        "id": "catalog",
        "kind": "service",
        "traffic": 30.2,
        "errors": 0.031,
        "p95_ms": 1180,
        "saturation": 0.96,
        "alive": true,
        "sat_label": "pool",
        "status": "failing",
        "assessment": "origin",
        "trend": { "errors": "rising", "latency": "rising", "saturation": "rising" },
        "extras": { "pool_in_use": 12, "pool_max": 12, "pool_wait_total": 87 },
        "revision": "v2",
        "checks": ["catalog_products_probe"],
        "logs_indexed": true
      },
      {
        "id": "checkout",
        "kind": "service",
        "traffic": 12.2,
        "errors": 0.002,
        "p95_ms": 180,
        "saturation": 0.42,
        "alive": true,
        "sat_label": "",
        "status": "ok",
        "assessment": "unassessed",
        "trend": { "errors": "flat", "latency": "flat", "saturation": "flat" },
        "extras": {},
        "revision": "v1",
        "checks": ["checkout_health"],
        "logs_indexed": true
      },
      {
        "id": "postgres",
        "kind": "datastore",
        "traffic": null,
        "errors": null,
        "p95_ms": null,
        "saturation": 0.52,
        "alive": true,
        "sat_label": "pool",
        "status": "ok",
        "assessment": "unassessed",
        "trend": { "errors": "na", "latency": "na", "saturation": "flat" },
        "extras": { "pool_in_use": 6, "pool_max": 12, "pool_wait_total": 0 },
        "checks": [],
        "logs_indexed": true
      }
    ],
    "edges": [
      {
        "from": "checkout",
        "to": "catalog",
        "kind": "calls",
        "rps": 12.2,
        "errors": 0.032,
        "p95_ms": 1200,
        "observed": true
      },
      {
        "from": "catalog",
        "to": "postgres",
        "kind": "uses",
        "rps": 30.2,
        "errors": 0.031,
        "p95_ms": 1180,
        "observed": true
      }
    ],
    "sources": {
      "prometheus": { "ok": true, "age_secs": 3 },
      "jaeger": { "ok": true, "age_secs": 1 },
      "logstore": { "ok": true, "age_secs": 0 }
    },
    "gap_before": null
  },
  "faults": { "instances": [], "generation": 0 },
  "incident": null,
  "capabilities": {},
  "next_step_zh": "請等待基線完成"
}
